<?xml version="1.0" encoding="UTF-8"?>
<ServiceBusConfig xmlns="http://www.w3school.com.cn" xmlns:xsi="http://www.w3.org/2001/XMLSchema-instance"
	xsi:schemaLocation="http://www.w3school.com.cn ServiceFramework.xsd" DefaultUseCacheGroup="cache0"
	DefaultUseHadoopGroup="hadoop0">


	<ImportResource Path="local.properties" Description="导入本地资源文件 " />
	<Parameter Name="load" Value="1" Description="定义全局参数" />
	<Parameter Name="guid" Value="dfds.fdf" Description="定义全局参数" />

	<DataSourceGroup Id="localDataGroup">
		<DataSource PoolClass="com.mchange.v2.c3p0.ComboPooledDataSource" Id="read">
			<Property Name="driverClass" Value="${import.jdbc.driverClass}"></Property>
			<Property Name="jdbcUrl" Value="${import.jdbc.url}"></Property>
			<Property Name="user" Value="${import.jdbc.userName}"></Property>
			<Property Name="password" Value="${import.jdbc.password}"></Property>
			<!-- 指定连接池中保留的最大连接数. Default:15 -->
			<Property Name="maxPoolSize" Value="${c3p0.maxPoolSize}" />
			<!-- 指定连接池中保留的最小连接数 -->
			<Property Name="minPoolSize" Value="${c3p0.minPoolSize}" />
			<!-- 指定连接池的初始化连接数 取值应在minPoolSize 与 maxPoolSize 之间.Default:3 -->
			<Property Name="initialPoolSize" Value="${c3p0.initialPoolSize}" />
			<!-- 最大空闲时间,60秒内未使用则连接被丢弃。若为0则永不丢弃。 Default:0 -->
			<Property Name="maxIdleTime" Value="${c3p0.maxIdleTime}" />
			<!-- 当连接池中的连接耗尽的时候c3p0一次同时获取的连接数. Default:3 -->
			<Property Name="acquireIncrement" Value="${c3p0.acquireIncrement}" />
			<!-- JDBC的标准,用以控制数据源内加载的PreparedStatements数量。但由于预缓存的statements属于单个connection而不是整个连接池所以设置这个参数需要考虑到多方面的因数.如果maxStatements与maxStatementsPerConnection均为0,则缓存被关闭。Default:0 -->
			<Property Name="maxStatements" Value="${c3p0.maxStatements}" />
			<!-- 每60秒检查所有连接池中的空闲连接.Default:0 -->
			<Property Name="idleConnectionTestPeriod" Value="${c3p0.idleConnectionTestPeriod}" />
			<!-- 定义在从数据库获取新连接失败后重复尝试的次数。 Default:30 -->
			<Property Name="acquireRetryAttempts" Value="${c3p0.acquireRetryAttempts}" />
			<!-- 获取连接失败将会引起所有等待连接池来获取连接的线程抛出异常。但是数据源仍有效保留,并在下次调用getConnection()的时候继续尝试获取连接。如果设为true,那么在尝试获取连接失败后该数据源将申明已断开并永久关闭。Default:false -->
			<Property Name="breakAfterAcquireFailure" Value="${c3p0.breakAfterAcquireFailure}" />
			<!-- 银性能消耗大请只在需要的时候是哟个它。如果设为true,那么在每个connection提交的时候都将校验其有效性。建议使用idleConnectionTestPeriod或automaticTestTable等提升连接测试的性能。 
				Default:false -->
			<Property Name="testConnectionOnCheckout" Value="${c3p0.testConnectionOnCheckout}" />
		</DataSource>
		<DataSource PoolClass="com.mchange.v2.c3p0.ComboPooledDataSource" Id="write">
			<Property Name="driverClass" Value="${import.jdbc.driverClass}"></Property>
			<Property Name="jdbcUrl" Value="${import.jdbc.url}"></Property>
			<Property Name="user" Value="${import.jdbc.userName}"></Property>
			<Property Name="password" Value="${import.jdbc.password}"></Property>
			<!-- 指定连接池中保留的最大连接数. Default:15 -->
			<Property Name="maxPoolSize" Value="${c3p0.maxPoolSize}" />
			<!-- 指定连接池中保留的最小连接数 -->
			<Property Name="minPoolSize" Value="${c3p0.minPoolSize}" />
			<!-- 指定连接池的初始化连接数 取值应在minPoolSize 与 maxPoolSize 之间.Default:3 -->
			<Property Name="initialPoolSize" Value="${c3p0.initialPoolSize}" />
			<!-- 最大空闲时间,60秒内未使用则连接被丢弃。若为0则永不丢弃。 Default:0 -->
			<Property Name="maxIdleTime" Value="${c3p0.maxIdleTime}" />
			<!-- 当连接池中的连接耗尽的时候c3p0一次同时获取的连接数. Default:3 -->
			<Property Name="acquireIncrement" Value="${c3p0.acquireIncrement}" />
			<!-- JDBC的标准,用以控制数据源内加载的PreparedStatements数量。但由于预缓存的statements属于单个connection而不是整个连接池所以设置这个参数需要考虑到多方面的因数.如果maxStatements与maxStatementsPerConnection均为0,则缓存被关闭。Default:0 -->
			<Property Name="maxStatements" Value="${c3p0.maxStatements}" />
			<!-- 每60秒检查所有连接池中的空闲连接.Default:0 -->
			<Property Name="idleConnectionTestPeriod" Value="${c3p0.idleConnectionTestPeriod}" />
			<!-- 定义在从数据库获取新连接失败后重复尝试的次数。 Default:30 -->
			<Property Name="acquireRetryAttempts" Value="${c3p0.acquireRetryAttempts}" />
			<!-- 获取连接失败将会引起所有等待连接池来获取连接的线程抛出异常。但是数据源仍有效保留,并在下次调用getConnection()的时候继续尝试获取连接。如果设为true,那么在尝试获取连接失败后该数据源将申明已断开并永久关闭。Default:false -->
			<Property Name="breakAfterAcquireFailure" Value="${c3p0.breakAfterAcquireFailure}" />
			<!-- 银性能消耗大请只在需要的时候是哟个它。如果设为true,那么在每个connection提交的时候都将校验其有效性。建议使用idleConnectionTestPeriod或automaticTestTable等提升连接测试的性能。 
				Default:false -->
			<Property Name="testConnectionOnCheckout" Value="${c3p0.testConnectionOnCheckout}" />
		</DataSource>
	</DataSourceGroup>

	<MemCacheServerGroup Id="cache0">
		<CacheServer Id="mainId0" MaxIdleTime="5" MinConnCount="2" MaxConnCount="30" InitConnCount="2">
			<Server Port="11211" IP="127.0.0.1" />
		</CacheServer>
	</MemCacheServerGroup>

	<HadoopServerGroup Id="hodoop0">
		<HadoopServer Name="Slave" IP="127.0.0.1" Prot="53200" />
	</HadoopServerGroup>

	<ServicePluginConfig AutoScanPath="com.liantong.service">
	</ServicePluginConfig>
</ServiceBusConfig>